id,title,score,num_comments,author,created_utc,url,over_18,edited,spoiler,stickied
1e6qny1,Can you be a data engineer without knowing advanced coding?,70,87,csh8428,2024-07-19 00:30:36,https://www.reddit.com/r/dataengineering/comments/1e6qny1/can_you_be_a_data_engineer_without_knowing/,False,False,False,False
1e71c1f,How important is tech stack vs. total compensation to you in data engineering?,54,42,level_126_programmer,2024-07-19 11:22:23,https://www.reddit.com/r/dataengineering/comments/1e71c1f/how_important_is_tech_stack_vs_total_compensation/,False,False,False,False
1e7fcmx,What I would do if had to re-learn Data Engineering Basics: ,47,8,rebecca-1313,2024-07-19 21:43:55,https://www.reddit.com/r/dataengineering/comments/1e7fcmx/what_i_would_do_if_had_to_relearn_data/,False,False,False,False
1e765oq,"Best way to move 10,000 JSON files from one S3 bucket to another?",31,43,cryptoyash,2024-07-19 15:14:18,https://www.reddit.com/r/dataengineering/comments/1e765oq/best_way_to_move_10000_json_files_from_one_s3/,False,False,False,False
1e6xy1q,How do you handle messy data from customers?,13,30,MrTelly,2024-07-19 07:28:09,https://www.reddit.com/r/dataengineering/comments/1e6xy1q/how_do_you_handle_messy_data_from_customers/,False,False,False,False
1e6wf4h,Incremental Data Load in ADF,11,3,Effective-Tie-3149,2024-07-19 05:47:48,https://www.reddit.com/r/dataengineering/comments/1e6wf4h/incremental_data_load_in_adf/,False,False,False,False
1e7hral,Is this one of them Iceberg tables everyone keeps talking about?,14,0,EarthGoddessDude,2024-07-19 23:32:45,https://i.redd.it/vuosxyf19kdd1.jpeg,False,False,False,False
1e6t9sy,Turn offs and Turn ons in personal projects? ,7,5,HarvesterOfReveries,2024-07-19 02:44:35,https://www.reddit.com/r/dataengineering/comments/1e6t9sy/turn_offs_and_turn_ons_in_personal_projects/,False,False,False,False
1e76e9o,Kimball modelling question,6,10,Altruistic_Menu_8312,2024-07-19 15:24:36,https://www.reddit.com/r/dataengineering/comments/1e76e9o/kimball_modelling_question/,False,False,False,False
1e72uc6,detailed real-world data modeling examples,6,2,johnsonfrusciante,2024-07-19 12:44:28,https://www.reddit.com/r/dataengineering/comments/1e72uc6/detailed_realworld_data_modeling_examples/,False,False,False,False
1e71wi8,Running DBT with Airflow,6,0,ps_kev_96,2024-07-19 11:55:32,https://towardsdev.com/from-idea-to-implementation-a-step-by-step-guide-to-starting-your-data-science-side-2701183b536e,False,False,False,False
1e6s3jy,The Data-Related “Red Flags” All Organisations Should Be Aware Of (And How To Avoid Them),6,3,teheditor,2024-07-19 01:43:29,https://smbtech.au/thought-leadership/the-data-related-red-flags-all-organisations-should-be-aware-of-and-how-to-avoid-them/,False,False,False,False
1e7c8uh,Create something like my data clean room,4,3,juanmac93,2024-07-19 19:30:56,https://www.reddit.com/r/dataengineering/comments/1e7c8uh/create_something_like_my_data_clean_room/,False,False,False,False
1e7btod,Learning Java for Data Engineering ,4,7,nifesimii,2024-07-19 19:12:57,https://www.reddit.com/r/dataengineering/comments/1e7btod/learning_java_for_data_engineering/,False,False,False,False
1e79ybs,Optimizing my Workflow with DuckDB: Seeking Advice,6,1,blue-lighty,2024-07-19 17:53:52,https://www.reddit.com/r/dataengineering/comments/1e79ybs/optimizing_my_workflow_with_duckdb_seeking_advice/,False,False,False,False
1e74k3j,7 Ways to Make Queries Faster,5,0,glaredb_tal,2024-07-19 14:05:03,https://glaredb.com/blog/7-ways-to-make-queries-faster,False,False,False,False
1e73o09,[GCP] Terraform module to stream Pub/Sub JSON to Cloud SQL,3,0,wil19558,2024-07-19 13:24:26,https://www.dataroc.ca/blog/terraform-module-to-stream-pubsub-json-to-cloud-sql-on-gcp,False,False,False,False
1e7dau7,CSVs processing with pyspark,3,4,EnvironmentalBed603,2024-07-19 20:16:09,https://www.reddit.com/r/dataengineering/comments/1e7dau7/csvs_processing_with_pyspark/,False,False,False,False
1e7669k,dbt Analytics Engineering Certification Exam,3,0,dataflakes,2024-07-19 15:15:00,https://www.reddit.com/r/dataengineering/comments/1e7669k/dbt_analytics_engineering_certification_exam/,False,False,False,False
1e6x721,Stored Procedure vs Script in Github,3,1,yiternity,2024-07-19 06:38:07,https://www.reddit.com/r/dataengineering/comments/1e6x721/stored_procedure_vs_script_in_github/,False,False,False,False
1e6r5no,Query Snowflake Iceberg tables with DuckDB & Spark to Save Costs,1,0,Buremba,2024-07-19 00:55:35,https://buremba.com/blog/use-snowflake-and-duckdb-with-iceberg,False,False,False,False
1e7djgn,What's the difference between 'Google Cloud Data Engineer Professional Certificate' on Coursera and 'Google Cloud Data Engineer Learning Path' on EDX?,2,1,SteffooM,2024-07-19 20:26:33,https://www.reddit.com/r/dataengineering/comments/1e7djgn/whats_the_difference_between_google_cloud_data/,False,False,False,False
1e6ukam,Data engineers who deal with unstructured data I need your help!,2,6,No_Communication2618,2024-07-19 03:55:53,https://www.reddit.com/r/dataengineering/comments/1e6ukam/data_engineers_who_deal_with_unstructured_data_i/,False,False,False,False
1e7i8vt,Seeking Advice on Transitioning from Data Analyst to Data Engineer,1,2,timevariant77,2024-07-19 23:56:49,https://www.reddit.com/r/dataengineering/comments/1e7i8vt/seeking_advice_on_transitioning_from_data_analyst/,False,False,False,False
1e7hw1u,Data engineer part time ,1,0,Mountain-Luck7673,2024-07-19 23:39:15,https://www.reddit.com/r/dataengineering/comments/1e7hw1u/data_engineer_part_time/,False,False,False,False
1e79ger,Looking for study partner ,1,1,No_Initiative3642,2024-07-19 17:32:42,https://www.reddit.com/r/dataengineering/comments/1e79ger/looking_for_study_partner/,False,False,False,False
1e6s33v,Data Contracts in Action: Testing,1,0,Pitah7,2024-07-19 01:42:51,https://medium.com/@pflooky/data-contracts-in-action-testing-111631338657?sk=8cea6c4e08a48d7e123b07b3e6a27713,False,False,False,False
1e7dnkm,AWS Glue Unable to Fetch Data from Amazon RDS?,0,4,RepresentativePen297,2024-07-19 20:31:21,https://www.reddit.com/r/dataengineering/comments/1e7dnkm/aws_glue_unable_to_fetch_data_from_amazon_rds/,False,False,False,False
1e78t8l,"Call and API, decode and the store in a SQL warehouse",0,1,random_postings,2024-07-19 17:05:36,https://www.reddit.com/r/dataengineering/comments/1e78t8l/call_and_api_decode_and_the_store_in_a_sql/,False,False,False,False
1e6vdob,No Bullshit BI,0,1,sbalnojan,2024-07-19 04:42:51,https://www.thdpth.com/p/no-bullshit-bi,False,False,False,False
